[
  {
    "id": "#1",
    "order": 1,
    "name": "[internal] load build definition from Dockerfile",
    "display_name": "[internal] load build definition from Dockerfile",
    "category": "internal",
    "status": "DONE",
    "duration": "0.0s",
    "duration_nanos": 0,
    "output_count": 0,
    "progress_count": 1,
    "warning_count": 0,
    "unknown_count": 0,
    "start_line": 1,
    "end_line": 3
  },
  {
    "id": "#2",
    "order": 2,
    "name": "importing cache manifest from local:cache",
    "display_name": "importing cache manifest from local:cache",
    "category": "cache",
    "status": "WARNING",
    "output_count": 0,
    "progress_count": 0,
    "warning_count": 1,
    "unknown_count": 0,
    "warning_detail": "local cache import failed",
    "start_line": 4,
    "end_line": 5
  },
  {
    "id": "#3",
    "order": 3,
    "name": "[1/4] FROM docker.io/library/alpine:3.20",
    "display_name": "FROM docker.io/library/alpine:3.20",
    "category": "dockerfile",
    "status": "DONE",
    "duration": "0.0s",
    "duration_nanos": 0,
    "index": 1,
    "total": 4,
    "instruction": "FROM",
    "output_count": 0,
    "progress_count": 0,
    "warning_count": 0,
    "unknown_count": 0,
    "start_line": 6,
    "end_line": 7
  },
  {
    "id": "#4",
    "order": 4,
    "name": "[2/4] RUN echo one \u0026\u0026 echo two \u0026\u0026 exit 1",
    "display_name": "RUN echo one \u0026\u0026 echo two \u0026\u0026 exit 1",
    "category": "dockerfile",
    "status": "ERROR",
    "index": 2,
    "total": 4,
    "instruction": "RUN",
    "output_count": 2,
    "output_tail": [
      "0.101 one",
      "0.102 two"
    ],
    "progress_count": 0,
    "warning_count": 0,
    "unknown_count": 0,
    "error_detail": "process \"/bin/sh -c echo one \u0026\u0026 echo two \u0026\u0026 exit 1\" did not complete successfully: exit code: 1",
    "start_line": 8,
    "end_line": 11
  },
  {
    "id": "#5",
    "order": 5,
    "name": "[stage-1 3/4] COPY --from=0 /out /out",
    "display_name": "COPY --from=0 /out /out",
    "category": "dockerfile",
    "status": "CACHED",
    "stage": "stage-1",
    "index": 3,
    "total": 4,
    "instruction": "COPY",
    "output_count": 0,
    "progress_count": 0,
    "warning_count": 0,
    "unknown_count": 0,
    "start_line": 12,
    "end_line": 13
  },
  {
    "id": "#6",
    "order": 6,
    "name": "resolving provenance for metadata file",
    "display_name": "resolving provenance for metadata file",
    "category": "provenance",
    "status": "DONE",
    "duration": "0.0s",
    "duration_nanos": 0,
    "output_count": 0,
    "progress_count": 0,
    "warning_count": 0,
    "unknown_count": 0,
    "start_line": 14,
    "end_line": 15
  },
  {
    "id": "#7",
    "order": 7,
    "name": "exporting cache to local directory",
    "display_name": "exporting cache to local directory",
    "category": "cache",
    "status": "DONE",
    "duration": "0.0s",
    "duration_nanos": 0,
    "output_count": 0,
    "progress_count": 0,
    "warning_count": 0,
    "unknown_count": 0,
    "start_line": 16,
    "end_line": 17
  },
  {
    "id": "#8",
    "order": 8,
    "name": "exporting to image",
    "display_name": "exporting to image",
    "category": "export",
    "status": "DONE",
    "duration": "0.0s",
    "duration_nanos": 0,
    "output_count": 0,
    "progress_count": 0,
    "warning_count": 0,
    "unknown_count": 0,
    "start_line": 18,
    "end_line": 19
  }
]
