[{"id":"#1","order":1,"name":"[internal] load build definition from Dockerfile","display_name":"[internal] load build definition from Dockerfile","category":"internal","status":"DONE","duration":"0.0s","duration_nanos":0,"output_count":0,"progress_count":0,"warning_count":0,"unknown_count":0,"start_line":1,"end_line":2},{"id":"#2","order":2,"name":"importing cache manifest from local:cache","display_name":"importing cache manifest from local:cache","category":"cache","status":"DONE","duration":"0.1s","duration_nanos":100000000,"output_count":0,"progress_count":0,"warning_count":0,"unknown_count":0,"start_line":3,"end_line":4},{"id":"#3","order":3,"name":"[build 1/3] RUN go mod download","display_name":"RUN go mod download","category":"dockerfile","status":"DONE","duration":"1.1s","duration_nanos":1100000000,"stage":"build","index":1,"total":3,"instruction":"RUN","output_count":2,"output_tail":["0.214 downloading github.com/example/module v1.2.3","1.041 downloaded github.com/example/module v1.2.3"],"progress_count":0,"warning_count":0,"unknown_count":0,"start_line":5,"end_line":13},{"id":"#4","order":4,"name":"[build 2/3] RUN go test ./...","display_name":"RUN go test ./...","category":"dockerfile","status":"DONE","duration":"0.4s","duration_nanos":400000000,"stage":"build","index":2,"total":3,"instruction":"RUN","output_count":2,"output_tail":["0.118 ?    example.com/app/internal/foo    [no test files]","0.342 ok   example.com/app/internal/bar    0.224s"],"progress_count":0,"warning_count":0,"unknown_count":0,"start_line":6,"end_line":11},{"id":"#5","order":5,"name":"[stage-1 1/2] COPY --from=build /out/app /app","display_name":"COPY --from=build /out/app /app","category":"dockerfile","status":"CACHED","stage":"stage-1","index":1,"total":2,"instruction":"COPY","output_count":0,"progress_count":0,"warning_count":0,"unknown_count":0,"start_line":9,"end_line":14},{"id":"#6","order":6,"name":"[stage-1 2/2] RUN chmod +x /app","display_name":"RUN chmod +x /app","category":"dockerfile","status":"DONE","duration":"0.2s","duration_nanos":200000000,"stage":"stage-1","index":2,"total":2,"instruction":"RUN","output_count":0,"progress_count":0,"warning_count":0,"unknown_count":0,"start_line":15,"end_line":16},{"id":"#7","order":7,"name":"exporting to image","display_name":"exporting to image","category":"export","status":"DONE","duration":"0.2s","duration_nanos":200000000,"output_count":0,"progress_count":2,"warning_count":0,"unknown_count":0,"start_line":17,"end_line":24},{"id":"#8","order":8,"name":"exporting cache to local directory","display_name":"exporting cache to local directory","category":"cache","status":"DONE","duration":"0.1s","duration_nanos":100000000,"output_count":0,"progress_count":2,"warning_count":0,"unknown_count":0,"start_line":19,"end_line":23},{"id":"#9","order":9,"name":"resolving provenance for metadata file","display_name":"resolving provenance for metadata file","category":"provenance","status":"DONE","duration":"0.0s","duration_nanos":0,"output_count":0,"progress_count":0,"warning_count":0,"unknown_count":0,"start_line":25,"end_line":26}]
