[{"id":"#1","order":1,"name":"[internal] load build definition from Dockerfile","display_name":"[internal] load build definition from Dockerfile","category":"internal","status":"DONE","duration":"0.0s","duration_nanos":0,"output_count":0,"progress_count":0,"warning_count":0,"unknown_count":0,"start_line":1,"end_line":2},{"id":"#2","order":2,"name":"importing cache manifest from local:cache","display_name":"importing cache manifest from local:cache","category":"cache","status":"WARNING","output_count":0,"progress_count":0,"warning_count":1,"unknown_count":0,"warning_detail":"local cache import failed","start_line":3,"end_line":4},{"id":"#3","order":3,"name":"[internal] load metadata for docker.io/library/alpine:3.20","display_name":"[internal] load metadata for docker.io/library/alpine:3.20","category":"internal","status":"DONE","duration":"0.5s","duration_nanos":500000000,"output_count":0,"progress_count":0,"warning_count":0,"unknown_count":0,"start_line":5,"end_line":6},{"id":"#4","order":4,"name":"[1/1] FROM docker.io/library/alpine:3.20","display_name":"FROM docker.io/library/alpine:3.20","category":"dockerfile","status":"CACHED","index":1,"total":1,"instruction":"FROM","output_count":0,"progress_count":0,"warning_count":0,"unknown_count":0,"start_line":7,"end_line":8},{"id":"#5","order":5,"name":"exporting to image","display_name":"exporting to image","category":"export","status":"DONE","duration":"0.0s","duration_nanos":0,"output_count":0,"progress_count":0,"warning_count":0,"unknown_count":0,"start_line":9,"end_line":10}]
